{
  "schema_version": "1.0",
  "created_at": "2026-02-17T00:00:00Z",
  "last_updated": "2026-02-17T00:00:00Z",
  "name": "supply_chain",
  "version": "1.0.0",
  "description": "Third-party JS/CSS supply chain risks. Checks for: SRI integrity missing on external scripts/stylesheets, scripts loading from known-bad or deprecated CDNs, vulnerable library versions via nuclei tech-detect.",
  "target_type": ["web"],
  "tool_dependencies": ["nuclei", "katana"],
  "playbook_dependencies": ["recon"],
  "depth_levels": {
    "quick": {
      "description": "nuclei supply chain templates on live hosts. ~10 min.",
      "estimated_duration_minutes": 10
    },
    "standard": {
      "description": "nuclei supply chain + katana JS file crawl + bad CDN detection. ~30 min.",
      "estimated_duration_minutes": 30
    },
    "exhaustive": {
      "description": "All standard + deep JS library version analysis + threat_alert CDN checks from /alerts/. ~90 min.",
      "estimated_duration_minutes": 90
    }
  },
  "throttle": {
    "requests_per_second": 50,
    "jitter_min_ms": 200,
    "jitter_max_ms": 600
  },
  "confidence_threshold_for_llm": 0.65,
  "author": "bb-beast",
  "tags": ["supply-chain", "sri", "cdn", "javascript", "third-party"]
}
