{
  "schema_version": "1.0",
  "created_at": "2026-02-17T00:00:00Z",
  "last_updated": "2026-02-17T00:00:00Z",
  "name": "cloud",
  "version": "1.0.0",
  "description": "Cloud misconfiguration detection — exposed S3 buckets, GCS, Azure blobs, cloud metadata endpoints (SSRF), nuclei cloud/misconfig templates.",
  "target_type": ["cloud", "web"],
  "tool_dependencies": ["s3scanner", "nuclei"],
  "playbook_dependencies": ["recon"],
  "depth_levels": {
    "quick": {
      "description": "s3scanner with generated bucket names + nuclei cloud templates. ~15 min.",
      "estimated_duration_minutes": 15
    },
    "standard": {
      "description": "s3scanner expanded names across AWS/GCP/DO + nuclei cloud/misconfig templates. ~40 min.",
      "estimated_duration_minutes": 40
    },
    "exhaustive": {
      "description": "All standard + s3scanner with enumerate + full cloud nuclei template set. ~2 hours.",
      "estimated_duration_minutes": 120
    }
  },
  "throttle": {
    "requests_per_second": 50,
    "jitter_min_ms": 200,
    "jitter_max_ms": 600
  },
  "confidence_threshold_for_llm": 0.70,
  "author": "bb-beast",
  "tags": ["cloud", "s3", "gcs", "azure", "ssrf", "misconfiguration"]
}
